{"controls":[{"evidenceRequirements":[],"id":"L9.CI.EVIDENCE_REVISION_CONSISTENCY","severity":"mandatory","version":"1.0.0","waiver":{"allowed":false,"requiredRoles":[]}},{"evidenceRequirements":[{"acceptedExecutionStatuses":["passed","failed","error","skipped"],"cardinality":{"maximum":1,"minimum":1},"check":"l9.lint","checkVersion":"1.0.0","configurationDigestRequired":true,"freshness":{"mode":"revision-bound"},"outputSchema":"l9.observation/v1","producer":"l9-ci-sdk","subjectBinding":{"exactRevision":true}}],"id":"L9.CI.LINT","severity":"mandatory","version":"1.0.0","waiver":{"allowed":true,"maximumDurationSeconds":604800,"requiredRoles":["repository-owner","security-owner"]}},{"evidenceRequirements":[{"acceptedExecutionStatuses":["passed","failed","error","skipped"],"cardinality":{"maximum":1,"minimum":1},"check":"l9.mandatory-findings","checkVersion":"1.0.0","configurationDigestRequired":true,"freshness":{"mode":"revision-bound"},"outputSchema":"l9.observation/v1","producer":"l9-ci-sdk","subjectBinding":{"exactRevision":true}}],"id":"L9.CI.MANDATORY_FINDINGS_ABSENT","severity":"mandatory","version":"1.0.0","waiver":{"allowed":true,"maximumDurationSeconds":604800,"requiredRoles":["repository-owner","security-owner"]}},{"evidenceRequirements":[{"acceptedExecutionStatuses":["passed","failed","error","skipped"],"cardinality":{"maximum":1,"minimum":1},"check":"l9.repository-metadata","checkVersion":"1.0.0","configurationDigestRequired":true,"freshness":{"mode":"revision-bound"},"outputSchema":"l9.observation/v1","producer":"l9-ci-sdk","subjectBinding":{"exactRevision":true}}],"id":"L9.CI.REPOSITORY_METADATA","severity":"mandatory","version":"1.0.0","waiver":{"allowed":false,"requiredRoles":[]}},{"evidenceRequirements":[{"acceptedExecutionStatuses":["passed","failed","error","skipped"],"cardinality":{"maximum":1,"minimum":1},"check":"l9.sdk-validation","checkVersion":"1.0.0","configurationDigestRequired":true,"freshness":{"mode":"revision-bound"},"outputSchema":"l9.observation/v1","producer":"l9-ci-sdk","subjectBinding":{"exactRevision":true}}],"id":"L9.CI.SDK_VALIDATION","severity":"mandatory","version":"1.0.0","waiver":{"allowed":false,"requiredRoles":[]}},{"evidenceRequirements":[{"acceptedExecutionStatuses":["passed","failed","error","skipped"],"cardinality":{"maximum":1,"minimum":1},"check":"l9.tests","checkVersion":"1.0.0","configurationDigestRequired":true,"freshness":{"mode":"revision-bound"},"outputSchema":"l9.observation/v1","producer":"l9-ci-sdk","subjectBinding":{"exactRevision":true}}],"id":"L9.CI.TESTS","severity":"mandatory","version":"1.0.0","waiver":{"allowed":true,"maximumDurationSeconds":604800,"requiredRoles":["repository-owner","security-owner"]}},{"evidenceRequirements":[{"acceptedExecutionStatuses":["passed","failed","error","skipped"],"cardinality":{"maximum":1,"minimum":1},"check":"l9.transport-packet","checkVersion":"1.0.0","configurationDigestRequired":true,"freshness":{"mode":"revision-bound"},"outputSchema":"l9.observation/v1","producer":"l9-ci-sdk","subjectBinding":{"exactRevision":true}}],"id":"L9.CI.TRANSPORT_PACKET","severity":"mandatory","version":"1.0.0","waiver":{"allowed":false,"requiredRoles":[]}}],"planDigest":{"algorithm":"sha256","value":"fee43e7ec28c6c4351135f66ffff214c53266323cc3fb82a4971c4ac839755ea"},"planId":"plan_fee43e7ec28c6c4351135f66ffff214c53266323","policy":{"digest":{"algorithm":"sha256","value":"1b7c43e6f0922886142420241e955e86a3fe0e39748bacca4d0d89e8e0171b16"},"id":"l9.organization-default","version":"1.0.0"},"profile":{"digest":{"algorithm":"sha256","value":"6794703d9be6abcaef6c3116bf1ac3123e89eeff946625f1912e880ff855c876"},"id":"l9.pull-request","version":"1.0.0"},"protocol":{"assuranceVersion":"2.0.1","bundleDigest":{"algorithm":"sha256","value":"46c8328bbdc12452f8c61f6e43c3b3f001189ccf8321a364d4c1f0f79c9d4e2a"},"canonicalization":"l9.canonical-json/v1","digestAlgorithm":"sha256","schemaVersion":"1.0.0"},"requiredChecks":[{"acceptedExecutionStatuses":["passed","failed","error","skipped"],"configurationDigestRequired":true,"deterministic":true,"id":"l9.lint","outputSchema":"l9.observation/v1","owner":"l9-ci-sdk","revisionBound":true,"version":"1.0.0"},{"acceptedExecutionStatuses":["passed","failed","error","skipped"],"configurationDigestRequired":true,"deterministic":true,"id":"l9.mandatory-findings","outputSchema":"l9.observation/v1","owner":"l9-ci-sdk","revisionBound":true,"version":"1.0.0"},{"acceptedExecutionStatuses":["passed","failed","error","skipped"],"configurationDigestRequired":true,"deterministic":true,"id":"l9.repository-metadata","outputSchema":"l9.observation/v1","owner":"l9-ci-sdk","revisionBound":true,"version":"1.0.0"},{"acceptedExecutionStatuses":["passed","failed","error","skipped"],"configurationDigestRequired":true,"deterministic":true,"id":"l9.sdk-validation","outputSchema":"l9.observation/v1","owner":"l9-ci-sdk","revisionBound":true,"version":"1.0.0"},{"acceptedExecutionStatuses":["passed","failed","error","skipped"],"configurationDigestRequired":true,"deterministic":true,"id":"l9.tests","outputSchema":"l9.observation/v1","owner":"l9-ci-sdk","revisionBound":true,"version":"1.0.0"},{"acceptedExecutionStatuses":["passed","failed","error","skipped"],"configurationDigestRequired":true,"deterministic":true,"id":"l9.transport-packet","outputSchema":"l9.observation/v1","owner":"l9-ci-sdk","revisionBound":true,"version":"1.0.0"}],"requiredProducers":[{"allowedVersions":null,"authorizationStatus":"pending","candidateVersionRange":">=2.0.0 <3.0.0","checks":["l9.lint","l9.mandatory-findings","l9.repository-metadata","l9.sdk-validation","l9.tests","l9.transport-packet"],"id":"l9-ci-sdk","repository":"Quantum-L9/l9-ci-sdk","subjectKinds":["git-revision"]}],"schema":"l9.assurance-plan","schemaVersion":"1.0.0","sourceDigests":{"checkRegistry":{"algorithm":"sha256","value":"7c2f66dea670ab904cbad0af33ab0a5f8e5ffddbd09de528c4cbcf3c8d366161"},"controls":{"algorithm":"sha256","value":"9104f5f6bc218ac0eca4af536d5173b96d65543063232a6535cb96f027179eaf"},"producerRegistry":{"algorithm":"sha256","value":"f5d232225a916fcd48276fbf7ca18ede813d7913603533aa648102498e653318"}},"subject":{"kind":"git-revision","repository":{"host":"github.com","name":"example","owner":"Quantum-L9"},"revision":{"commit":"aaaaaaaaaaaaaaaaaaaaaaaaaaaaaaaaaaaaaaaa"}},"waiverRules":[{"allowed":false,"controlId":"L9.CI.EVIDENCE_REVISION_CONSISTENCY","maximumDurationSeconds":null,"requiredRoles":[]},{"allowed":true,"controlId":"L9.CI.LINT","maximumDurationSeconds":604800,"requiredRoles":["repository-owner","security-owner"]},{"allowed":true,"controlId":"L9.CI.MANDATORY_FINDINGS_ABSENT","maximumDurationSeconds":604800,"requiredRoles":["repository-owner","security-owner"]},{"allowed":false,"controlId":"L9.CI.REPOSITORY_METADATA","maximumDurationSeconds":null,"requiredRoles":[]},{"allowed":false,"controlId":"L9.CI.SDK_VALIDATION","maximumDurationSeconds":null,"requiredRoles":[]},{"allowed":true,"controlId":"L9.CI.TESTS","maximumDurationSeconds":604800,"requiredRoles":["repository-owner","security-owner"]},{"allowed":false,"controlId":"L9.CI.TRANSPORT_PACKET","maximumDurationSeconds":null,"requiredRoles":[]}]}
